{
  "$schema": "https://json-schema.org/draft/2020-12/schema",
  "$id": "https://federated-agent-web.dev/schemas/delegation.schema.json",
  "title": "FAW Delegation",
  "description": "Normative signed delegation for the Federated Agent Web contract. Admitted at most once per (issuer_node_id, attempt_id) within the receiver's persisted replay window.",
  "type": "object",
  "additionalProperties": false,
  "required": ["kind", "spec_version", "id", "issued_at", "issuer", "body", "signature"],
  "properties": {
    "kind": { "const": "faw-delegation" },
    "spec_version": { "enum": ["0.2"] },
    "id": { "type": "string", "pattern": "^[0-9a-f]{8}-[0-9a-f]{4}-[47][0-9a-f]{3}-[89ab][0-9a-f]{3}-[0-9a-f]{12}$" },
    "issued_at": { "type": "string", "pattern": "^\\d{4}-\\d{2}-\\d{2}T\\d{2}:\\d{2}:\\d{2}(\\.\\d{1,9})?Z$" },
    "issuer": {
      "type": "object",
      "additionalProperties": false,
      "required": ["node_id", "kid"],
      "properties": {
        "node_id": { "type": "string", "pattern": "^urn:faw:[a-z0-9](?:[a-z0-9._-]{0,62})$" },
        "kid": { "type": "string", "pattern": "^sha256:[0-9a-f]{64}$" }
      }
    },
    "body": {
      "type": "object",
      "additionalProperties": false,
      "oneOf": [
        { "required": ["target_node_id"] },
        { "required": ["capability_target"] }
      ],
      "required": [
        "task_id", "attempt_id", "issuer_node_id", "capability", "input",
        "authority", "budget", "deadline", "expected_output",
        "expires_at"
      ],
      "properties": {
        "task_id": { "type": "string", "pattern": "^[0-9a-f]{8}-[0-9a-f]{4}-[47][0-9a-f]{3}-[89ab][0-9a-f]{3}-[0-9a-f]{12}$" },
        "attempt_id": { "type": "string", "pattern": "^[0-9a-f]{8}-[0-9a-f]{4}-[47][0-9a-f]{3}-[89ab][0-9a-f]{3}-[0-9a-f]{12}$" },
        "issuer_node_id": { "type": "string", "pattern": "^urn:faw:[a-z0-9](?:[a-z0-9._-]{0,62})$" },
        "target_node_id": { "type": "string", "pattern": "^urn:faw:[a-z0-9](?:[a-z0-9._-]{0,62})$" },
        "capability_target": {
          "type": "object",
          "additionalProperties": false,
          "required": ["capability"],
          "properties": {
            "capability": { "type": "string", "pattern": "^[a-z][a-z0-9]*(?:[._-][a-z0-9]+)*$" }
          }
        },
        "capability": { "type": "string", "pattern": "^[a-z][a-z0-9]*(?:[._-][a-z0-9]+)*$" },
        "input": {
          "type": "object",
          "additionalProperties": false,
          "required": ["kind"],
          "properties": {
            "kind": { "enum": ["inline", "refs"] },
            "data": { "type": "object" },
            "refs": {
              "type": "array",
              "minItems": 1,
              "items": {
                "type": "object",
                "additionalProperties": false,
                "required": ["digest", "location"],
                "properties": {
                  "digest": { "type": "string", "pattern": "^sha256:[0-9a-f]{64}$" },
                  "location": { "type": "string", "minLength": 1, "maxLength": 512 }
                }
              }
            }
          },
          "oneOf": [
            {
              "properties": {
                "kind": { "const": "inline" },
                "data": { "type": "object" }
              },
              "required": ["data"]
            },
            {
              "properties": {
                "kind": { "const": "refs" },
                "refs": { "type": "array", "minItems": 1 }
              },
              "required": ["refs"]
            }
          ]
        },
        "authority": {
          "type": "object",
          "additionalProperties": false,
          "required": ["actions", "expiry"],
          "properties": {
            "actions": {
              "type": "array",
              "minItems": 1,
              "uniqueItems": true,
              "items": { "type": "string", "pattern": "^[a-z][a-z0-9]*(?:[._-][a-z0-9]+)*$" }
            },
            "filesystem_scope": {
              "type": "object",
              "additionalProperties": false,
              "properties": {
                "read_paths": { "type": "array", "items": { "type": "string", "minLength": 1, "maxLength": 1024 } },
                "write_paths": { "type": "array", "items": { "type": "string", "minLength": 1, "maxLength": 1024 } }
              }
            },
            "network_scope": {
              "type": "object",
              "additionalProperties": false,
              "properties": {
                "allow_hosts": { "type": "array", "items": { "type": "string", "minLength": 1, "maxLength": 255 } },
                "allow_ports": { "type": "array", "items": { "type": "integer", "minimum": 0, "maximum": 65535 } }
              }
            },
            "external_effect_scope": {
              "type": "object",
              "additionalProperties": false,
              "properties": {
                "allowed_effects": { "type": "array", "minItems": 1, "items": { "type": "string", "minLength": 1, "maxLength": 128 } }
              }
            },
            "expiry": { "type": "string", "pattern": "^\\d{4}-\\d{2}-\\d{2}T\\d{2}:\\d{2}:\\d{2}(\\.\\d{1,9})?Z$" }
          }
        },
        "budget": {
          "type": "object",
          "additionalProperties": false,
          "properties": {
            "max_wall_seconds": { "type": "integer", "minimum": 0 },
            "max_tokens": { "type": "integer", "minimum": 0 },
            "max_cost_usd": { "type": "string", "pattern": "^(0|[1-9]\\d*)(\\.\\d+)?$" },
            "max_output_bytes": { "type": "integer", "minimum": 0 }
          }
        },
        "deadline": { "type": "string", "pattern": "^\\d{4}-\\d{2}-\\d{2}T\\d{2}:\\d{2}:\\d{2}(\\.\\d{1,9})?Z$" },
        "expected_output": {
          "type": "object",
          "additionalProperties": false,
          "required": ["kind", "media_type"],
          "properties": {
            "kind": { "type": "string", "minLength": 1, "maxLength": 64 },
            "media_type": { "type": "string", "pattern": "^[a-z0-9]+/[a-z0-9.+-]+$" },
            "schema": { "anyOf": [{ "type": "object" }, { "type": "null" }] },
            "required_artifacts": { "type": "array", "items": { "type": "string", "minLength": 1, "maxLength": 128 } },
            "expects_repository_mutation": { "type": "boolean" }
          }
        },
        "expires_at": { "type": "string", "pattern": "^\\d{4}-\\d{2}-\\d{2}T\\d{2}:\\d{2}:\\d{2}(\\.\\d{1,9})?Z$" }
      }
    },
    "signature": {
      "type": "object",
      "additionalProperties": false,
      "required": ["alg", "value"],
      "properties": {
        "alg": { "const": "Ed25519" },
        "value": { "type": "string", "pattern": "^[A-Za-z0-9_-]{86}$" }
      }
    }
  }
}
